name,url,type,description
Cage Key,http://darksouls.wikidot.com/cage-key,Keys,"Key to the hanging cage in Sen's Fortress. If a hapless adventurer becomes fatigued during an imprudent attempt to overcome the fortress, the serpent men will not kill him, but lock him up in a lonely cage. Eventually, unless they have forgotten, they drag the victim off to who-knows-where."
Crest Key,http://darksouls.wikidot.com/crest-key,Keys,"Bent Crest Key.
The grooves of the crest are enchanted,
the door sealed with a powerful spell."
Crest of Artorias,http://darksouls.wikidot.com/crest-of-artorias,Keys,"This crest opens a door in the Darkroot Garden sealed by ancient magic. This door leads to the grave of Sir Artorias the Abysswalker. Many adventurers have left for the grave, but none have returned for they make easy prey for local bandits,
With such dangers, the crest can do more harm than good in the hands of the uninitiated."
Dungeon Cell Key,http://darksouls.wikidot.com/dungeon-cell-key,Keys,"Key to the dungeon of the Undead Asylum to
the North. A mysterious knight, without saying a word,
shoved a corpse down into the cell, and on
its person was this key. Who was this knight?
And was was his purpose? There may be no
answer, but one must still forge ahead."
Key to New Londo Ruins,http://darksouls.wikidot.com/key-to-new-londo-ruins,Keys,"Key to the iron bars separating the ruins of
New Londo and Drake Valley. The ruins of New Londo were blocked off,
for the cursed ghosts posed danger to life
and spirit, and the legends speak of a
terrible Dark that was sealed away."
Key to the Depths,http://darksouls.wikidot.com/key-to-the-depths,Keys,"Key opening the door from the lower
Undead Burg to the Depths. Those banished from the Undead Burg eke out
their existence in the Depths, a damp lair
with no trace of sunlight. Nearly half of
the Depths form a perilous flooded labyrinth."
Key to the Seal,http://darksouls.wikidot.com/key-to-the-seal,Keys,"Key to the floodgates of New Londo, which seal away the Four Kings who fell to Dark. The Sealers flooded New Londo to banish the Darkwraiths and the Four Kings. The agonizing decision was made with the realization that countless lives, and the robust culture of the city, would be lost. The victims now roam the ruins as ghosts."
Master Key,http://darksouls.wikidot.com/master-key,Keys,"This universal key opens any basic lock.
Tool of the trade for thieves. But in the cursed land of the Undead,
most doors are better left unopened."
Mystery Key,http://darksouls.wikidot.com/mystery-key,Keys,"The purpose of this key is unknown.
Resembles a basic prison cell key."
Peculiar Doll,http://darksouls.wikidot.com/peculiar-doll,Keys,"A strange doll in strange dress. There once was an abomination who had
no place in this world. She clutched this
doll tightly, and eventually was drawn into
a cold and lonely painted world."
Residence Key,http://darksouls.wikidot.com/residence-key,Keys,"Key to a residence in the Undead Burg.
Simple, sturdy design of the locks in
the Burg keep out unwanted visitors. But this is a standard key in these parts,
and will open several residences."
Undead Asylum F2 East Key,http://darksouls.wikidot.com/undead-asylum-f2-east-key,Keys,"Key to the iron bars on the east side of the
second floor of the North Undead Asylum. The Undead Asylum is a giant Undead prison,
segmented by countless iron bars. Even if an Undead were to escape from a
cell, passage to the outside world would
not be gained easily."
Undead Asylum F2 West Key,http://darksouls.wikidot.com/undead-asylum-f2-west-key,Keys,"Key to the iron bars on the west side of the
second floor of the North Undead Asylum. The Undead Asylum is a giant Undead prison,
segmented by countless iron bars. But even if a hero found a key in Lordran
to liberate this prison, would he have the
means, or the heart, to ever come back?"
Sewer Chamber Key,http://darksouls.wikidot.com/sewer-chamber-key,Keys,"Key to the sewer chamber in the Depths. In any community, a few bad apples are sure
to exhibit insatiable greed. If they were
turned Undead, and banished to the Depths,
would they reconsider their ways? Use this key to see for yourself."
Watchtower Basement Key,http://darksouls.wikidot.com/watchtower-basement-key,Keys,"Key to the basement of the watchtower in
the Undead Burg. The basement of the watchtower forms a stone
cell. There are rumors of a hero turned
Hollow who was locked away by a dear friend.
For his own good, of course."
Black Separation Crystal,http://darksouls.wikidot.com/black-separation-crystal,Multiplayer Items,"This black crystal, long a symbol of
farewell, is granted to banished Undead.
The crystal sends phantoms back to their
homes, or sends you back to yours. Beware of fickle use of the item if you
intend to nurture relations."
Orange Guidance Soapstone,http://darksouls.wikidot.com/orange-guidance-soapstone,Multiplayer Items,"Online play item.
Write/view/rate message. Messages transmit to other worlds, where they
are rated. Also, rate messages of others. In Lordran, the flow of time is distorted,
and messages allow Undead to assist
(or deceive) one another."
Purple Coward's Crystal,http://darksouls.wikidot.com/purple-coward-s-crystal,Multiplayer Items,"Online play item.
Quit Battle of Stoicism.
(Session ends if host leaves) Victory in this battle once led to ancient
Anor Londo, but even in the absence
of it's overseer, capitulation is a disgrace.
In the name of a warrior's honor, do not
quickly resort to the use of this crystal."
Red Sign Soapstone,http://darksouls.wikidot.com/red-sign-soapstone,Multiplayer Items,"Online play item.
Leaves invasion sign.
(Hollows cannot use the item) Be summoned to another world as a dark
spirit, and defeat the summoner to acquire
humanity.
Certain Darkwraiths resist their descent into
dark and preserve along the honorable path.
The Red Soapstone is for them."
White Sign Soapstone,http://darksouls.wikidot.com/white-sign-soapstone,Multiplayer Items,"Online play item.
Leave summon sign. Be summoned to another world as a phantom
through your sign, and defeat the area boss
to acquire humanity.
(Hollows cannot conduct summons) In Lordran, the flow of time is distorted,
and the White Sign Soapstone allows
Undead to assist one another."
Black Eye Orb,http://darksouls.wikidot.com/black-eye-orb,Multiplayer Items,"Mystical orb found on a Keeper's corpse. Invade the world of the murderer of a
Fire Keeper, to defeat the perpetrator and
reclaim the soul of the Fire Keeper. The Black Eye keeps constant watch on the
city of the Gods, Anor Londo."
Blue Eye Orb,http://darksouls.wikidot.com/blue-eye-orb,Multiplayer Items,"Online play item.
Invade world of player in Book of the Guilty.
Subdue player to acquire Souvenir of Reprisal.
(Only Covenanter can use the item) These mystical orbs are granted to
Blades of the Darkmoon, knights who serve
the Dark Sun Gwyndolin, so that they may
serve the Gods in meting out vengenance."
Cracked Red Eye Orb,http://darksouls.wikidot.com/cracked-red-eye-orb,Multiplayer Items,"Online play item.
Invade another world.
(Hollows cannot use the item) Defeat the master of the world you have
invaded to acquire humanity. The Cracked Red Eye Orb allows players to
temporarily imitate this ability normally
limited to the Darkwraiths of Kaathe."
Red Eye Orb,http://darksouls.wikidot.com/red-eye-orb,Multiplayer Items,"Online play item.
Invade another world.
(Only Covenanter can use the item while Hollows cannot) Defeat the master of the world you have
invaded to acquire humanity. The Darkwraiths of Kaathe use this orb to
seek humanity and plunge further into dark.
Perhaps they are more human than we?"
Dragon Eye,http://darksouls.wikidot.com/dragon-eye,Multiplayer Items,"Online play item.
Find a player who has acquired a Dragon Scale
and invade that player's world to pillage it.
(Only Covenanter can use the item). An art of the transcendent apostles who pray
to the ancient dragons. To be alive is to be
vulnerable, and the fiery Gods are no
exception. The apostles seek another plane
of existence, which transcends life."
Dragon Head Stone,http://darksouls.wikidot.com/dragon-head-stone,Multiplayer Items,"Stone imbued with the power of the dragons.
Rite of apostles of the ancient dragons.
Gain head of dragon. Emit dragon breath. The dragon apostles seek transcendence of
life itself, attainable by transformation
into an ancient dragon. This rite is only one
step, but it cannot be reversed until death."
Dragon Torso Stone,http://darksouls.wikidot.com/dragon-torso-stone,Multiplayer Items,"Stone imbued with the power of the dragons.
Rite of apostles of the ancient dragons.
Gain torso of dragon. Roar like a dragon. The dragon apostles seek transcendence of
life itself, attainable by transformation
into an ancient dragon. This rite is only one
step, but it cannot be reversed until death."
Eye of Death,http://darksouls.wikidot.com/eye-of-death,Multiplayer Items,"Online play item.
Lure phantoms from other worlds.
(Only Covenanter can use the item while Hollows cannot) The dreadful Eyes of Death spread disaster
across neighboring worlds. Phantoms lured
to the host world may end up as victims,
allowing the Eyes of Death to multiply,
and leading to further proliferation of bane."
Souvenir of Reprisal,http://darksouls.wikidot.com/souvenir-of-reprisal,Multiplayer Items,"Blood-Drained, shrunken ear.
Souvenir taken for subduing the guilty. The knights called the Blades of the Darkmoon
punish the guilt-soaked offenders of the Gods
and take this as proof of their conquest.
The earless corpses of the guilty will be
left behind as a warning to others, inspiring
both fear and respect for the Gods. Such is
the eternal mandate of the Dark Sun."
Sunlight Medal,http://darksouls.wikidot.com/sunlight-medal,Multiplayer Items,"This faintly warm medal engraved with the
symbol of the Sun, is the ultimate honor,
awarded to those who summon the Warrior
of Sunlight and complete a goal. The symbol represents Lord Gwyn's firstborn,
who lost his deity status and was expunged
from the annals. But the old God of War
still watches closely over his warriors."
Hello Carving,http://darksouls.wikidot.com/hello-carving,Multiplayer Items,"Head carved of archtrees by Gough in his
imprisonment. Gough imparts an emotion to
each and every completed carving, which
helps him achieve personal enlightenment.
When a head is disturbed, it speaks,
reflecting the emotion conferred to it. This head says ""Hello"". Have another look.
Do you sense the amicability in its eyes?"
Very Good! Carving,http://darksouls.wikidot.com/very-good-carving,Multiplayer Items,"Head carved of archtrees by Gough in his
imprisonment. Gough imparts an emotion to
each and every completed carving, which
helps him achieve personal enlightenment.
When a head is disturbed, it speaks,
reflecting the emotion conferred to it. This head says ""Very Good!"". Have another
look. Does it not appear quite jovial?"
Thank You Carving,http://darksouls.wikidot.com/thank-you-carving,Multiplayer Items,"Head carved of archtrees by Gough in his
imprisonment. Gough imparts an emotion to
each and every completed carving, which
helps him achieve personal enlightenment.
When a head is disturbed, it speaks,
reflecting the emotion conferred to it. This head says ""Thank you"". Have another
look. Is this not the face of gratitude?"
I'm Sorry Carving,http://darksouls.wikidot.com/i-m-sorry-carving,Multiplayer Items,"Head carved of archtrees by Gough in his
imprisonment. Gough imparts an emotion to
each and every completed carving, which
helps him achieve personal enlightenment.
When a head is disturbed, it speaks,
reflecting the emotion conferred to it. This head says ""I'm Sorry"". Have another look.
Isn't that an expression of atonement?"
Help Me! Carving,http://darksouls.wikidot.com/help-me-carving,Multiplayer Items,"Head carved of archtrees by Gough in his
imprisonment. Gough imparts an emotion to
each and every completed carving, which
helps him achieve personal enlightenment.
When a head is disturbed, it speaks,
reflecting the emotion conferred to it. This head says ""Help me!"". Have another
look. Can you hear the desperate plea?"
Book of the Guilty,http://darksouls.wikidot.com/book-of-the-guilty,Multiplayer Items,"Online play item.
Check list of indicted players. The Goddess of Sin Velka oversees this list
of the guilty, who have disrespected the Gods
or their covenants, and shall one day face
the wrath of the Blades of the Darkmoon."
Dried Finger,http://darksouls.wikidot.com/dried-finger,Multiplayer Items,"Dried Finger with multiple knuckles.
Shriveled but still slightly warm. With this many knuckles,
surely it cannot be anything human."
Indictment,http://darksouls.wikidot.com/indictment,Multiplayer Items,"Slip sold by bishop of Velka, Goddess of Sin.
If you are killed by an invader, use this
to report the crime of the trespasser. The indicted player will be added to a list
of unfortunate souls who will one day face
the wrath of the Blades of the Darkmoon"
Servant Roster,http://darksouls.wikidot.com/servant-roster,Multiplayer Items,"Online play item.
Check servants of the Daughters of Chaos. Egg-bearer Eingyi keeps this roster of those
who serve his master, a Daughter of Chaos.
Eingyi praises those who offer significant
humanity to alleviate his master's suffering. But what is praise from Eingyi really worth?"
Bellowing Dragoncrest Ring,http://darksouls.wikidot.com/bellowing-dragoncrest-ring,Rings,"A special ring granted to only the most
accomplished sorcerers at the Vinheim Dragon
School. The ring is engraved with an everlasting
dragon, and boosts the strength of sorceries."
Bloodbite Ring,http://darksouls.wikidot.com/bloodbite-ring,Rings,"One of the infamous bite rings commissioned by Sir Arstor of Carim. Despite the dreadful rumors surrounding its creation, this ring is an unmistakable
asset, in its ability to help prevent bleeding."
Blue Tearstone Ring,http://darksouls.wikidot.com/blue-tearstone-ring,Rings,"The rare gem called tearstone has the
uncanny ability to sense imminent death. This blue tearstone from Catarina boosts
the defence of its wearer when in danger."
Calamity Ring,http://darksouls.wikidot.com/calamity-ring,Rings,"A ring enchanted by the orange eye
of Kalameet, the bringer of calamity.
Doubles damage received by its wearer. A useless ring befitting of no finger.
Best left unknown, or at least well hidden."
Cat Covenant Ring,http://darksouls.wikidot.com/cat-covenant-ring,Rings,"Ring granted to those bound by the
Forest Hunter covenant.
Answer Alvina's summoning. The white cat Alvina speaks a human tongue
and has lived since the early Age of Fire.
Alvina was a trusted friend of Knight
Artorias and the Great Wolf Sif."
Cloranthy Ring,http://darksouls.wikidot.com/cloranthy-ring,Rings,"This ancient ring, engraved with a large green flower, is of unknown origin. Hastens the regeneration of stamina."
Covenant Of Artorias,http://darksouls.wikidot.com/covenant-of-artorias,Rings,"This ring symbolizes Knight Artorias's
covenant with the beasts of the Abyss. It's wearer, like Artorias himself, can
traverse the Abyss."
Covetous Gold Serpent Ring,http://darksouls.wikidot.com/covetous-gold-serpent-ring,Rings,"The serpent is an imperfect dragon and symbol
of the Undead. Its habit of devouring prey
even larger than itself has led to an
association with gluttony. This gold ring, engraved with the serpent,
boosts its wearer's item discovery, so that
more items can be amassed."
Covetous Silver Serpent Ring,http://darksouls.wikidot.com/covetous-silver-serpent-ring,Rings,"The serpent is an imperfect dragon and symbol
of the Undead. Its habit of devouring prey
even larger than itself has led to an
association with gluttony. This silver ring, engraved with the serpent,
rewards its wearer with additional souls
for each kill."
Cursebite Ring,http://darksouls.wikidot.com/cursebite-ring,Rings,"One of the infamous bite rings
commissioned by Sir Arstor of Carim. Despite the dreadful rumors surrounding its
creation, this ring is an unmistakable asset,
in its ability to help prevent curses."
Darkmoon Blade Covenant Ring,http://darksouls.wikidot.com/darkmoon-blade-covenant-ring,Rings,"Ring granted to those bound by the
Darkmoon Blade Covenant.
Answer Dark Sun Gwyndolin's summoning. Gwyndolin, all too aware of his repulsive,
frail appearance, created the illusion of
a sister Gwynevere, who helps him guard
over Anor Londo. An unmasking of these
deities would be tantamount to blasphemy."
Darkmoon Seance Ring,http://darksouls.wikidot.com/darkmoon-seance-ring,Rings,"This ring is granted to adherents of
Gwyndolin, Darkmoon deity and
last born of Gwyn, Lord of Sunlight.
Grants additional magic and attunement slots. The Dark Sun Gwyndolin is the only remaining
deity in Anor Londo. His followers are few,
but their tasks are of vital importance."
Dark Wood Grain Ring,http://darksouls.wikidot.com/dark-wood-grain-ring,Rings,"This special ring crafted in an Eastern land is made
of gold, but with a wood grain crest on its surface. Agents of subterfuge in this faraway land are particularly
fond of the dark gold wood grain, which greatly
alters its wearer's rolling action."
Dusk Crown Ring,http://darksouls.wikidot.com/dusk-crown-ring,Rings,"This magic crown-shaped ring was granted to
Princess Dusk of Oolacile upon her birth. The ringstone allows its wearer to cast additional
sorceries, but at the cost of one-half of HP."
East Wood Grain Ring,http://darksouls.wikidot.com/east-wood-grain-ring,Rings,"This special ring crafted in an Eastern land
is made of gold, but with a wood grain crest
on its surface. The ring slows the loss of weapon durability
and is particularly useful to bearers of
delicate swords crafted in the East."
Flame Stoneplate Ring,http://darksouls.wikidot.com/flame-stoneplate-ring,Rings,"Stoneplates, the symbol of a true knight,
grant the strength to face various hardships. The red stoneplate symbolizes fire,
and boosts defense against flame."
Havel's Ring,http://darksouls.wikidot.com/havel-s-ring,Rings,"This ring was named after Havel the Rock,
Lord Gwyn's old battlefield compatriot. Havel's men wore the ring to express faith in
their leader and to carry a heavier load."
Hawk Ring,http://darksouls.wikidot.com/hawk-ring,Rings,"One of the special rings granted to the four
knights of Gwyn, The Hawk Ring belongs to
Hawkeye Gough, who led the Greatarchers. Boosts bow range, so that arrows fly like
they were shot by Gough's great bow,
which took down high-flying dragons."
Hornet Ring,http://darksouls.wikidot.com/hornet-ring,Rings,"One of the special rings granted to the four
knights of Gwyn. The Hornet Ring belonged
to the Lord's Blade Ciaran. By boosting critical attacks, its wearer can
annihilate foes, as Ciaran's dagger laid
waste to Lord Gwyn's enemies"
Leo Ring,http://darksouls.wikidot.com/leo-ring,Rings,"One of the special rings granted to the four
knights of Gwyn. The Leo Ring belonged to
Ornstein the Dragonslayer. This ring strengthens counters with pierce
weapons. His lugged spear is said
to have sliced a boulder in two."
Lingering Dragoncrest Ring,http://darksouls.wikidot.com/lingering-dragoncrest-ring,Rings,"A special ring granted to only the most accomplished
sorcerers at Vinheim Dragon School. The ring is engraved with a lingering dragon,
and boosts the length of the effects of sorceries."
Old Witch's Ring,http://darksouls.wikidot.com/old-witch-s-ring,Rings,"Old ring from an old witch. Engraved minutely with
indecipherable script, but seemingly useless."
Orange Charred Ring,http://darksouls.wikidot.com/orange-charred-ring,Rings,"An orange ring enchanted by a witch.
Reduces lava damage. Since his sores were inflamed by lava
from birth, his witch sisters gave him
this special ring. But fool that he is,
he readily dropped it, and from that spot,
a terrible centipede demon was born."
Poisonbite Ring,http://darksouls.wikidot.com/poisonbite-ring,Rings,"One of the infamous bite rings commissioned by Sir Arstor of Carim. Despite the dreadful rumors surrounding its creation, this ring
is an unmistakable asset, in its ability to help prevent poison."
Rare Ring of Sacrifice,http://darksouls.wikidot.com/rare-ring-of-sacrifice,Rings,"This mystical ring was created in a
sacrificial rite of Velka, the Goddess of Sin.
The magenta-shaded ring is especially rare.
Its wearer will lose nothing upon death, and
will be freed from any curse whatsoever, but the ring itself breaks.
""Die, lose nothing, nullify curse, ring breaks."""
Red Tearstone Ring,http://darksouls.wikidot.com/red-tearstone-ring,Rings,The rare gem called tearstone has the uncanny ability to sense imminent death. This red tearstone from Carim boosts the attack of its wearer when in danger.
Ring of Favor and Protection,http://darksouls.wikidot.com/ring-of-favor-and-protection,Rings,"A ring symbolizing the favor and
protection of the goddess Fina,
known in legend to possess ""fateful beauty."" This ring boosts its wearer's HP, stamina,
and max equipment load, but breaks if
ever removed."
Ring of Fog,http://darksouls.wikidot.com/ring-of-fog,Rings,"Those who befriend Alvina are given
this mysterious ring. It resembles a pearl with
its robust pure-white fog. The ring camouflages its wearer's
presence, helping to prevent detection."
Ring of Sacrifice,http://darksouls.wikidot.com/ring-of-sacrifice,Rings,"This mystical ring was created in a
sacrificial rite of Velka, the Goddess
of Sin. Its wearer will lose nothing upon death,
but the ring itself breaks."
Ring of Steel Protection,http://darksouls.wikidot.com/ring-of-steel-protection,Rings,"This ring belonged to the Knight King Rendal.
It grants its wearer protection by boosting
defense against physical attacks. Of the many legends surrounding the Knight
King Rendal, one of the more well-known
speaks of his standing down a giant drake
and slashing it to pieces."
Ring of the Evil Eye,http://darksouls.wikidot.com/ring-of-the-evil-eye,Rings,"According to legend, this ring contains the
spirit of the evil eye, a dark beast which
assaulted Astora. The strength of the evil eye does not waver,
and HP is absorbed from fallen enemies."
Ring of the Sun's Firstborn,http://darksouls.wikidot.com/ring-of-the-sun-s-firstborn,Rings,"Lord Gwyn's firstborn, who inherited the
sunlight, once wore this ancient ring.
Boosts the strength of miracles. Lord Gwyn's firstborn was a god of war,
but his foolishness led to a loss of the
annals, and rescinding of his deific status.
Today, even his name is not known."
Ring of the Sun Princess,http://darksouls.wikidot.com/ring-of-the-sun-princess,Rings,"This ring is granted to those who enter a
Covenant with Gwynevere, daughter of Lord Gywn
and the Princess of Sunlight. This slightly
warm ring boosts the synergy of miracles. The Princess of Sunlight Gwynevere left
Anor Londo along many other deities,
and later became wife to Flame God Flann."
Rusted Iron Ring,http://darksouls.wikidot.com/rusted-iron-ring,Rings,"This iron ring was used to shackle the guilty.
It is terribly rusted, and faintly stained with blood. Those who find this strange ring to their liking will
be pleased to find it easier to gain footing
on poor ground such as swamps."
Slumbering Dragoncrest Ring,http://darksouls.wikidot.com/slumbering-dragoncrest-ring,Rings,"This ring was secretly worn by a certain
surreptitious sorcerer at Vinheim Dragon
School. The ring is engraved with an everlasting
dragon in silent slumber, and masks all
sound emitting from its wearer."
Speckled Stoneplate Ring,http://darksouls.wikidot.com/speckled-stoneplate-ring,Rings,"Stoneplates, the symbol of a true knight,
grant the strength to face various hardships. The precious rare speckled stoneplate grants
a small boost to defence against magic,
flame and lightning."
Spell Stoneplate Ring,http://darksouls.wikidot.com/spell-stoneplate-ring,Rings,"Stoneplates, the symbol of a true knight, grant the strength to face various hardships
The blue stoneplate symbolizes souls, and boost defense against magic."
Thunder Stoneplate Ring,http://darksouls.wikidot.com/thunder-stoneplate-ring,Rings,"Stoneplates, the symbol of a true knight, grant the strength to face various hardships
The yellow stoneplate symbolizes souls, and boost defense against lightning."
Tiny Being's Ring,http://darksouls.wikidot.com/tiny-being-s-ring,Rings,"Ring made of an ancient tiny red jewel.
Grants small increase to HP. Rings grant powers large and small.
Their discovery, and effective use,
can make one's journey easier."
White Seance Ring,http://darksouls.wikidot.com/white-seance-ring,Rings,"A divine ring entrusted to the head bishop
of the Way of White and apostle to
Allfather Lloyd, uncle to Lord Gwyn.
It grants additional attunement slots. The head bishop of the Way of White is the
guardian of law and caste, and one of the
great royals of Thorolund."
Wolf Ring,http://darksouls.wikidot.com/wolf-ring,Rings,"One of the special rings granted to the four knights of Gwyn.
The wolf ring belongs to Artorias the Abysswalker.
Artorias had an unbendable will of steel,
and was unmatched with a greatsword."
Balder Helm,http://darksouls.wikidot.com/balder-helm,Head,"Helm worn by the knights of the ancient
kingdom of Balder. It is made from thick
iron plates. Balder was the homeland of the Knight
King Rendal, but it came to ruin after a
great many Undead were spawned."
Big Hat,http://darksouls.wikidot.com/big-hat,Head,"Gigantic hat worn by the great sorcerer
Logan. It completely hid his face, which led
to his nickname ""Big Hat."" Famously antisocial, Logan used it to block
out noise and people's stares so he could
focus on his own thoughts, but it does not
possess any special magic powers."
Black Iron Helm,http://darksouls.wikidot.com/black-iron-helm,Head,"Helm of Black Iron Tarkus, a knight known
for his great strength. Built of a special black iron and
providing strong defense, notably
against fire, but so terrible heavy to be
unwieldy to all but Tarkus himself."
