name,url,type,description
Black Knight Helm,http://darksouls.wikidot.com/black-knight-helm,Head,"Helm of the Black Knights who haunt Lordran. The knights followed Lord Gwyn when he
departed to link the flame, but they
were burned to ashes in newly kindled
fire, wandering the world as disembodied
spirits ever after."
Black Sorcerer Hat,http://darksouls.wikidot.com/black-sorcerer-hat,Head,"Hat worn by the secret sorcerers at Vinheim
Dragon School. They secretly work with sound-based spells,
and never reveal themselves."
Bloated Head,http://darksouls.wikidot.com/bloated-head,Head,"The head of an Oolacile resident whose
humanity went wild after being devoured
by the Dark of Manus, Father of the Abyss. The bloated head is fissured, the cracks
lined with innumerable tiny red eyeballs
with a hard outside and mucous-filled
inside, no sane person could ever wear it."
Bloated Sorcerer Head,http://darksouls.wikidot.com/bloated-sorcerer-head,Head,"The head of an Oolacile resident whose
humanity went wild after being devoured
by the Dark of manus, Father of the Abyss. The bloated head is fissured, the cracks
lined with innumerable tiny red eyeballs
and accented by protuding brain parts.
It is lightly enchanted, suggesting that it
may have belonged to a sorcerer."
Brass Helm,http://darksouls.wikidot.com/brass-helm,Head,"Helm of the Darkmoon Knightess,
Fire Keeper of Anor Londo. After becoming Undead, she visited the Dark
Sun Gwyndolin at the Mausoleum of the Spiral
Depths, became a Blade of Darkmoon,
and assumed the flame-keeping duty. She
received this helm, which hides her hideous
form and helps her hunt the guilty."
Brigand Hood,http://darksouls.wikidot.com/brigand-hood,Head,"Hood worn by the brigands who raid mountain
hamlets and attack travelers. In addition to protecting against the blazing
sun, dust, and sand, it helps them tell
friend from foe in the heat of battle."
Catarina Helm,http://darksouls.wikidot.com/catarina-helm,Head,"Distinctively shaped helm worn by the
Knights of Catarina. Outside Catarina, they are often ridiculed for
their onion-like shape, infuriating the proud
knights, but the masterfully forged curved
design makes it very effective for parrying."
Chain Helm,http://darksouls.wikidot.com/chain-helm,Head,"A chainmail helm of thin interlinking rings
of steel. It is common throughout the human
world since it can be easily produced, it is not
too heavy, and offers good defense. Knights may favor flashy armor, but for
warriors on the battlefield, anything is
fine as long as it keeps them alive."
Cleric Helm,http://darksouls.wikidot.com/cleric-helm,Head,"Helm worn by the warrior clerics of the
Way of White, who are famous for being
unyielding in battle. It is rather substantial in size and weight, making
its wearer look even bigger than
he actually is."
Crown of Dusk,http://darksouls.wikidot.com/crown-of-dusk,Head,"Special magic crown bestowed upon
Dusk, Princess of Oolacile, upon her birth. Its wearer is blessed by all manner of magic.
This raises the power and effect of the wearer's
magic, but damage suffered by magic attack also rises."
Crown of the Dark Sun,http://darksouls.wikidot.com/crown-of-the-dark-sun,Head,"Crown of the Dark Sun Gwyndolin, protector
of the forsaken city of Anor Londo. This crown of the gods demands faith
immeasurable of its wearer, but it is imbued
with Darkmoon power that enhances all magic.
The image of the sun manifests Gwyndolin's
deep adoration of the sun."
Crown of the Great Lord,http://darksouls.wikidot.com/crown-of-the-great-lord,Head,"Crown of Gwyn, Lord of Cinder, who linked
the First Flame. Lord Gwyn, bearer of the ultimate soul,
divided that power among his great clan before
linking the flame. But he did keep his crown,
perhaps to preserve a symbol of the monarch,
for its actual power had fully subsided."
Crystalline Helm,http://darksouls.wikidot.com/crystalline-helm,Head,"Helm worn by a Hollowed knight, who was
partially crystallized. The crystal power provides powerful defense,
but it cannot be used for long because it is
easily broken and cannot be repaired."
Dark Mask,http://darksouls.wikidot.com/dark-mask,Head,"Mask of the Darkwraiths, former knights of
New Londo who descended into Dark. Some say the skeletal mask of an ancient
Darkwraith is partially fused with the flesh
of its face."
Dingy Hood,http://darksouls.wikidot.com/dingy-hood,Head,"Worn by the Fire Keeper at Firelink Shrine. It is thought to have once been the white
hood of a maiden, but smoke and ashes
from bonfires darkened it over the
years."
Eastern Helm,http://darksouls.wikidot.com/eastern-helm,Head,"A distinctive helm made in an Eastern land. Exquisitely crafted, this helm offers
excellent defense, particularly versus slash
attacks, which are one of the main threats in
battles in the East."
Elite Cleric Helm,http://darksouls.wikidot.com/elite-cleric-helm,Head,"Helm worn by the warrior clerics of the
Way of White, who are famous for being
unyielding in battle. Among such helms, those that were black
belonged to warrior clerics sent on missions,
many of whom were high-level priests."
Elite Knight Helm,http://darksouls.wikidot.com/elite-knight-helm,Head,"Helm of a nameless knight, perhaps an elite
knight of Astora. Although he was loath to give up on his
Undead mission, he perished at the Undead
Asylum, and went Hollow."
Fang Boar Helm,http://darksouls.wikidot.com/fang-boar-helm,Head,"Severed head of the fully-armored Fang Boar
taken by the one who killed it as proof of
his victory, just as the Gods once did with
the head of the ancient dragon. Can be worn on the head as a surprisingly
sound piece of protective gear."
Gargoyle Helm,http://darksouls.wikidot.com/gargoyle-helm,Head,"Helm of the gargoyle, an enchanted creature
that guarded the Bell of Awakening in the
belfry of the Undead Church. This bronze helm was for mere appearance's
sake, as gargoyle skin is naturally hard.
Little in the way of defense can be expected
from it."
Giant Helm,http://darksouls.wikidot.com/giant-helm,Head,"Helm of the giant sentinels of Anor Londo. Made from ancient brass, it also offers
protection versus non-physical attacks, but
due to its giant size, it is extremely heavy
for humans, and impedes stamina recovery."
Gold-Hemmed Black Hood,http://darksouls.wikidot.com/gold-hemmed-black-hood,Head,"Worn by the witch Quelana of Izalith, mother
of pyromancy and Daughter of Chaos. She wore this gold-hemmed black hood before
even the Age of Fire, and it offers strong
resistance versus fire, poison, and other
perils."
Golem Helm,http://darksouls.wikidot.com/golem-helm,Head,"Head of the Iron Golem, guardian of the
ancient Sen's Fortress, slayer of heroes who
ventured forth to Anor Londo. Without its core, it is a mere hunk of iron,
and can be equipped as solid protective gear,
but its immense weight hinders stamina
recovery."
Gough`s Helm,http://darksouls.wikidot.com/gough-s-helm,Head,"Helm of Hawkeye Gough,
one of Gwyn's Four Knights.
Received as a decoration of knightly honor. A helm crafted especially for the honorable Hawkeye Gough,
only the eye holes were packed with tree resin
by those who dismissed Gough as a brutish giant."
Guardian Helm,http://darksouls.wikidot.com/guardian-helm,Head,"Helm of the stone knights,
guardians of the forest sanctuary. The stone knights are golems animated by magic,
and their enchanted helms are oppressively heavy."
Havel`s Helm,http://darksouls.wikidot.com/havel-s-helm,Head,"Helm worn by Havel the Rock's warriors.
Carved from solid rock, its tremendous weight
is matched only by the defense it provides. Havel's warriors never flinched nor retreated
from battle. Those unfortunate enough to face
them were inevitably beaten to a pulp."
Helm of Artorias,http://darksouls.wikidot.com/helm-of-artorias,Head,"Helm of Artorias the Abysswalker,
one of Gwyn's four knights. The death of the helm's owner can be surmised from the corrosive Dark of the Abyss,
and the musty azure-blue tassel, once a symbol of pride and glory."
Helm of Favor,http://darksouls.wikidot.com/helm-of-favor,Head,"Helm of Lautrec the Embraced,
representing the goddess Fina's love. During his solitude, he forsook everything,
for he believed in the goddess's love for
him."
Helm of The Wise,http://darksouls.wikidot.com/helm-of-the-wise,Head,"A strange helm from the ancient land of Zena,
birthplace of the curious dealer Domhnall. The two horns are believed to symbolize
wisdom."
Helm of Thorns,http://darksouls.wikidot.com/helm-of-thorns,Head,"Helm of Kirk, knight of Thorns and notorious
member of the Darkwraiths. A dense patch of
thorns grows from its surface. It is a fitting item for the murderous Kirk,
for by simply wearing it and rolling, one can
damage enemies."
Hollow Soldier Helm,http://darksouls.wikidot.com/hollow-soldier-helm,Head,"Helm worn by Hollow soldiers. It may be old
and battered, but its iron construction makes
it quite sturdy. It is wise to wear a sturdy form of head
protection against arrows and other physical
threats."
Hollow Thief`s Hood,http://darksouls.wikidot.com/hollow-thief-s-hood,Head,"Hood worn by Hollow thieves.
Used to hide a guilty countenance."
Hollow Warrior Helm,http://darksouls.wikidot.com/hollow-warrior-helm,Head,"Helm worn by Hollow warriors. Although it is
made of iron, it is old, battered and worn
out. It is wise to wear a sturdy form of head
protection against arrows and other physical
threats."
Iron Helm,http://darksouls.wikidot.com/iron-helm,Head,"Helm of Solaire of Astora, Knight of
Sunlight. Of high quality, but lacking any
particular powers. Solaire's incredible prowess must have
come from rigorous training alone, for
his equipment exhibits no special traits."
Knight Helm,http://darksouls.wikidot.com/knight-helm,Head,"Helm of a lower-rank knight. Despite the
thin metal used, the grooved texture gives
it added protection."
Mage Smith Hat,http://darksouls.wikidot.com/mage-smith-hat,Head,"Hat worn by proper mage smiths who
studied at Vinheim Dragon School. Mage smiths learn their craft alongside
sorcerers, but apply their sorcery to
forging weapons with magic embers."
Maiden Hood,http://darksouls.wikidot.com/maiden-hood,Head,"White hood worn by traveling maidens. It is
part of their formal attire, regardless of
rank. It is soft and well-made, but does not offer
much in the way of defense, making it ill-
suited to use in battle."
Mask of the Child,http://darksouls.wikidot.com/mask-of-the-child,Head,"One of the three masks of the Pinwheel,
the necromancer who stole the power of the
Gravelord, and reigns over the Catacombs. This mask, belonging to the naive child,
slightly raises stamina recovery speed."
Mask of the Father,http://darksouls.wikidot.com/mask-of-the-father,Head,"One of the three masks of the Pinwheel,
the necromancer who stole the power of the
Gravelord, and reigns over the Catacombs. This mask, belonging to the valiant father,
slightly raises equipment load."
Mask of the Mother,http://darksouls.wikidot.com/mask-of-the-mother,Head,"One of the three masks of the Pinwheel,
the necromancer who stole the power of the
Gravelord, and reigns over the Catacombs. This mask, belonging to the kindly mother,
slightly raises HP."
Mask of the Sealer,http://darksouls.wikidot.com/mask-of-the-sealer,Head,"Mask of the sorcerers who flooded New Londo
to seal away the Darkwraiths, and the
Four Kings who descended into Dark. It symbolizes their resolve to keep the seal
shut forever and their atonement for all who
were sacrificed, but two of the three forsook
New Londo upon tiring of their duty."
Mask of Velka,http://darksouls.wikidot.com/mask-of-velka,Head,"Mask worn by pardoners serving Velka,
the Goddess of Sin. The pardoners listen to the confessions of
sinners, urging reflection and salvation.
Their masks symbolize separation from
worldly desires."
Ornstein`s Helm,http://darksouls.wikidot.com/ornstein-s-helm,Head,"Helm of the dragonslayer Ornstein, who
guards the cathedral in the forsaken city of
Anor Londo. Ornstein is believed to be the captain of the
Four Knights. His golden lion helm is imbued
with the power of lightning and should
provide good protection against it."
Painting Guardian Hood,http://darksouls.wikidot.com/painting-guardian-hood,Head,"Hood worn by the alabaster-clothed guardians
of the paintings in Anor Londo. Offer
substantial protection versus magic. They have guarded the Great Painting of
Ariamis for ages, passing their duty down
through generations, but the reason for
doing so passed from all memory long ago."
Paladin Helm,http://darksouls.wikidot.com/paladin-helm,Head,"Helm of Leeroy, Paladin of the Catacombs. Long ago, the Way of the White produced its
first Undead, a paladin in golden armor.
With the legendary treasures Grant and
Sanctus, Leeroy set out for Lordran,
Land of the Gods, in the first Undead
mission of the Way of White."
Pharis`s Hat,http://darksouls.wikidot.com/pharis-s-hat,Head,"Broad-brimmed hat favored by the archer hero
Pharis. Pharis was an accomplished archer, and though
he was human, he ranked alongside Hawkeye
Gough, one of the Four Knights of Lord
Gwyn. His hat is universally popular among
children."
Porcelain Mask,http://darksouls.wikidot.com/porcelain-mask,Head,"Mask of the Lord's Blade Ciaran,
one of Gwyn's Four Knights. The cyclops headpiece is common to all of the Lord's Blades, but Ciaran was determined
to earn this soft porcelain mask as a unique decoration of honor. The mask is lined with
ivory locks of hair."
Priest`s Hat,http://darksouls.wikidot.com/priest-s-hat,Head,"Distinctive hat worn only by Way of White
priests in Thorolund. It is simply meant to show their position
within the hierarchy. It holds almost no
meaning in the land of Lordran."
Royal Helm,http://darksouls.wikidot.com/royal-helm,Head,"Helm of Vamos, skeleton blacksmith of the
Catacombs. Partially made of gold, and
confers high resistance overall. The helm is believed to belong to an ancient
royal line, but only Vamos would know for
sure, and he shall never speak again."
Sack,http://darksouls.wikidot.com/sack,Head,"Bloodstained patchwork sack by the Undead
man-eating cook lurking in the Depths. Two
eyeholes have been haphazardly cut out. It is unexpectedly soft and comfortable to
wear, but it is probably near meaningless
in terms of defense."
Shadow Mask,http://darksouls.wikidot.com/shadow-mask,Head,"Black cloth mask worn by spooks from an
Eastern land. Designed so as not to hinder
their unique form of martial arts. While it sacrifices defense for the sake of
greater mobility, it does offer resistance
to bleeding and poison among other things,
perhaps due to the nature of their duty."
Silver Knight Helm,http://darksouls.wikidot.com/silver-knight-helm,Head,"Helm of the Silver Knights who protect Anor
Londo. When Lord Gwyn departed to link the Fire,
his knights split into two groups. The Silver
Knights remained in the forsaken capital in
the service of their goddess."
Six-Eyed Helm of the Channelers,http://darksouls.wikidot.com/six-eyed-helm-of-the-channelers,Head,"Helm of the Channelers, sorcerers that serve
Seath the Scaleless. The six eyes arranged
in two vertical columns compensate for
Seath's lack of sight. The heaviest of protective gear for
sorcerers, and imbued with magic."
Smough`s Helm,http://darksouls.wikidot.com/smough-s-helm,Head,"Helm of Smough, the Executioner, protector
of the cathedral at the forsaken city of Anor
Londo. It offers extremely high defense
and can be worn by humans, but not
without great difficulty."
Snickering Top Hat,http://darksouls.wikidot.com/snickering-top-hat,Head,"Black top hat worn by Marvellous Chester,
a man of mystery lost in the past. The wearer of this top hat cracks a dubious,
permanent grin. The Curse of Chester!"
Sorcerer Hat,http://darksouls.wikidot.com/sorcerer-hat,Head,"Hat worn by proper sorcerers who
studied at Vinheim Dragon School. The majority take pride in having studied at
the academy and look down on breaking the
formal dress code established for sorcerers."
Standard Helm,http://darksouls.wikidot.com/standard-helm,Head,"A sturdy helm made of iron. Very common
type of protective gear, it provides
a sound level of defense. It is wise to wear a sturdy form of head
protection against arrows and other physical
threats."
Steel Helm,http://darksouls.wikidot.com/steel-helm,Head,"Helm of the Knights of Berenike, known for
their heavy armaments and armor. Countless Knights of Berenike, once
extolled as the mightiest of mighty, became
Undead and ventured to Lordran. But their
journey was for naught, as they went Hollow,
and became a threat to all Undead."
Stone Helm,http://darksouls.wikidot.com/stone-helm,Head,"Moss-covered helm of the Stone Knight,
defender of the Darkroot Garden. The Stone Knight is a product of ancient
magic, and although this helm is also imbued
with magic, it is incredibly heavy."
Sunlight Maggot,http://darksouls.wikidot.com/sunlight-maggot,Head,"A loathsome parasite that inhabits Lost
Izalith. It is completely immobile, yet still
lives. When worn on the head, it emanates
blinding light, which is why it is known
as a Sunlight Maggot."
Symbol of Avarice,http://darksouls.wikidot.com/symbol-of-avarice,Head,"Monster head resembling a treasure chest.
Once an ancient god, it is said this is the
symbol of shame imposed on a long lost clan,
exiled for the sin of avarice. Wearing this slightly raises soul absorption
and item discovery, but also affects its
wearer with the curse of the branded."
Tattered Cloth Hood,http://darksouls.wikidot.com/tattered-cloth-hood,Head,"Hood worn by pyromancers of the Great Swamp.
Though it appears tattered, it is actually
quite strong. Their attire offers substantial protection
against poison, fire, and other forces of
nature out in the hinterlands where they
were driven."
Thief Mask,http://darksouls.wikidot.com/thief-mask,Head,"Mask of sinners. They hide their faces,
stifle their voices and hide in the shadows.
It does not provide much in the way of
defense."
Wanderer Hood,http://darksouls.wikidot.com/wanderer-hood,Head,"Hood of an aimless traveler. Made from sturdy
leather, it offers protection versus wind
and rain."
Witch Hat,http://darksouls.wikidot.com/witch-hat,Head,"Hat of the rogue witch Beatrice. Almost all magic users that employ a wand
studied at Dragon School, but Beatrice is
one of the few exceptions. She braved the
Abyss but did not live to tell of her ordeal."
Xanthous Crown,http://darksouls.wikidot.com/xanthous-crown,Head,"A mysterious item once worn by the Xanthous
King Jeremiah, the legendary exile. No one
knows where it came from. The crown bears high-quality cloth which is
quite soft to the touch, but its bright
yellow color stings the eyes, and it is
clearly far too big."
Antiquated Dress,http://darksouls.wikidot.com/antiquated-dress,Chest,"A dress from the ancient fallen
land of Oolacile. Its ivory-colored
silk features elaborate embroidery
and is imbued with ancient magic power. One cannot expect any physical
protection from this garment,
as it was not meant to be worn in battle."
Armor of Artorias,http://darksouls.wikidot.com/armor-of-artorias,Chest,"Armor of Artorias the Abysswalker,
one of Gwyn's four knights. The death of the armor's owner can be surmised from the corrosive Dark of the Abyss,
and the tattered azure-blue cape, once a symbol of pride and glory."
Armor of the Glorious,http://darksouls.wikidot.com/armor-of-the-glorious,Chest,"Strange armor from the ancient land of Zena,
birthplace of the curious dealer Domhnall. The many medals are believed to symbolize
glory."
Armor of the Sun,http://darksouls.wikidot.com/armor-of-the-sun,Chest,"Armor of Solaire of Astora, Knight of
Sunlight. The large holy symbol of the Sun,
while powerless, was painted by Solaire himself. Solaire's incredible prowess must have
come from rigorous training alone, for
his equipment exhibits no special traits."
Armor of Thorns,http://darksouls.wikidot.com/armor-of-thorns,Chest,"Armor of Kirk, knight of Thorns and notorious
member of the Darkwraiths. A dense patch of
thorns grows from its surface. It is a fitting item for the murderous Kirk,
for by simply wearing it and rolling, one can
damage enemies."
Balder Armor,http://darksouls.wikidot.com/balder-armor,Chest,"Armor worn by the knights of the ancient
kingdom of Balder. It is made from thick
iron plates. Balder was the homeland of the Knight
King Rendal, but it came to ruin after a
great many Undead were spawned."
Black Cleric Robe,http://darksouls.wikidot.com/black-cleric-robe,Chest,"Robe worn by pardoners serving Velka,
the Goddess of Sin. The pardoners' attire is uniformly black in
color and said to be imbued with Velka's
mystical power, which provides resistance
against all manner of magic."
Black Iron Armor,http://darksouls.wikidot.com/black-iron-armor,Chest,"Armor of Black Iron Tarkus, a knight
known for his great strength. Built of a special black iron and
providing strong defense, notably
against fire, but so terrible heavy to be
unwieldy to all but Tarkus himself."
Black Knight Armor,http://darksouls.wikidot.com/black-knight-armor,Chest,"Armor of the Black Knight who haunt Lordran. The knights followed Lord Gwyn when he
departed to link the flame, but they
were burned to ashes in newly kindled
fire, wandering the world as disembodied
spirits ever after."
Black Leather Armor,http://darksouls.wikidot.com/black-leather-armor,Chest,"This armor made of smooth black leather is
extremely quiet, a good thing for those who
hide in the shadows. The leather itself is thick, offering a
decent level of protection."
Black Sorcerer Cloak,http://darksouls.wikidot.com/black-sorcerer-cloak,Chest,"Cloak worn by the secret sorcerers at
Vinheim Dragon School. They secretly work with sound-based spells,
and never reveal themselves."
Brass Armor,http://darksouls.wikidot.com/brass-armor,Chest,"Armor of the Darkmoon Knightess,
Fire Keeper of Anor Londo. After becoming Undead, she visited the Dark
Sun Gwyndolin at the Mausoleum of the Spiral
Depths, became a Blade of Darkmoon,
and assumed the flame-keeping duty. She
received this armor, which hides her hideous
form and helps her hunt the guilty."
Brigand Armor,http://darksouls.wikidot.com/brigand-armor,Chest,"Armor worn by the brigands who raid mountain
hamlets and attack travelers. The addition of metal over a base of cloth
and leather offers good mobility and defense."
Catarina Armor,http://darksouls.wikidot.com/catarina-armor,Chest,"Distinctively shaped armor worn by the
Knights of Catarina. Outside of Caterina, it is often ridiculed for
their onion-like shape, infuriating the proud
knights, but the masterfully forged curved
design makes it very effective for parrying."
Chain Armor,http://darksouls.wikidot.com/chain-armor,Chest,"Chainmail armor of thin interlinking rings of
steel. It is common throughout the human
world since it can be easily produced, is not
too heavy, and offers good defense. Knights may favor flashy armor, but for
warriors on the battlefield, anything is
fine as long as it keeps them alive."
Chester`s Long Coat,http://darksouls.wikidot.com/chester-s-long-coat,Chest,"Black leather long coat hat worn by Marvellous Chester,
a man of mystery lost in the past. This exquisitely sewn aristocratic suit allows its wearer
to move in silence, lending well to stealth."
Cleric Armor,http://darksouls.wikidot.com/cleric-armor,Chest,"Armor worn by the warrior clerics of the
Way of White, who are famous for being
unyielding in battle. It is rather substantial in size and weight, making
its wearer look even bigger than
he actually is."
Crimson Robe,http://darksouls.wikidot.com/crimson-robe,Chest,"Robe of the sorcerers who flooded
New Londo to seal away the Dark wraiths,
and the Four Kings who descended into Dark. The Sealers were once known as healers,
and the bright crimson was a symbol of that."
Crystalline Armor,http://darksouls.wikidot.com/crystalline-armor,Chest,"Armor worn by a Hollowed knight, who was
partially crystallized. The crystal provides powerful defense, but
it cannot be used for long because it is
easily broken and cannot be repaired."
Dark Armor,http://darksouls.wikidot.com/dark-armor,Chest,"Armor of the Darkwraiths, former knights of
New Londo who descended into Dark. Their armor transformed, and remains a
symbol of the Dark servants and their
diabolical art of Lifedrain."
Dingy Robe,http://darksouls.wikidot.com/dingy-robe,Chest,"Worn by the Fire Keeper at Firelink Shrine. It is thought to have once been the white
robe of a maiden, but smoke and ashes
from bonfires darkened it over the
years."
Eastern Armor,http://darksouls.wikidot.com/eastern-armor,Chest,"A distinctive armor made in an Eastern land. Exquisitely crafted, this armor offers
excellent defense, particularly versus slash
attacks, which are one of the main threats in
battles in the East."
Elite Cleric Armor,http://darksouls.wikidot.com/elite-cleric-armor,Chest,"Armor worn by the warrior clerics of the
Way of White, who are famous for being
unyielding in battle. Among such armors, those that were black
belonged to warrior clerics sent on missions,
many of whom were high-level priests."
Elite Knight Armor,http://darksouls.wikidot.com/elite-knight-armor,Chest,"Armor of a nameless knight, perhaps an elite
knight of Astora, based on the fire-warding
heraldic symbol on its blue surcoat. Although he was loath to give up on his
Undead mission, he perished at the Undead
Asylum, and went Hollow."
Embraced Armor of Favor,http://darksouls.wikidot.com/embraced-armor-of-favor,Chest,"Armor of Lautrec the Embraced,
representing the goddess Fina's love. The goddess's arms wrap around it, as if to
embrace the wearer."
Giant Armor,http://darksouls.wikidot.com/giant-armor,Chest,"Armor of the giant sentinels of Anor Londo. Made from ancient brass, it also offers
protection versus non-physical attacks, but
due to its giant size, it is extremely heavy
for humans, and impedes stamina recovery1."
